sentence,aspect,description,input_text,label
"vai tốt đường may tốt, với mức tiền đó cảm thấy hài lòng tuy nhiên đặt 29 giao 31, rất là rộng không sua được. nên tạm cho 2 . lần này đặt tiếp 1 quần 29 giao đúng thì vào đánh giá lại 5 nè",giao_hang,ship giao hàng vận chuyển giao lâu,"vai tốt đường may tốt, với mức tiền đó cảm thấy hài lòng tuy nhiên đặt 29 giao 31, rất là rộng không sua được. nên tạm cho 2 . lần này đặt tiếp 1 quần 29 giao đúng thì vào đánh giá lại 5 nè [SEP] ship giao hàng vận chuyển giao lâu",0
"sản phẩm giao nhanh, với giá 160k thì sản phẩm này gọi là tạm chấp nhận được chứ mà bán với giá gốc 300 cành thì quần này rất xấu quần chỉ thừa rất nhiều. chất lượng hoàn thiện chưa cao, không ai nói đây là hàng cao cấp cả, chỉ là quần thường thôi, đường may xấu không đều",gia_cong,đường may gia công chỉ may,"sản phẩm giao nhanh, với giá 160k thì sản phẩm này gọi là tạm chấp nhận được chứ mà bán với giá gốc 300 cành thì quần này rất xấu quần chỉ thừa rất nhiều. chất lượng hoàn thiện chưa cao, không ai nói đây là hàng cao cấp cả, chỉ là quần thường thôi, đường may xấu không đều [SEP] đường may gia công chỉ may",1
"quần mua về thấy đục lỗ sẵn, hàng cũ hay gì bị lừa rồi, thấy nhiều lượt mua nên mua mà vậy thất vọng",gia_cong,đường may gia công chỉ may,"quần mua về thấy đục lỗ sẵn, hàng cũ hay gì bị lừa rồi, thấy nhiều lượt mua nên mua mà vậy thất vọng [SEP] đường may gia công chỉ may",1
"quần có chất liệu như thun có thể co giãn, nhưng mặc được 1 lần thì bị rách đường chỉ gần đáy quần",doi_tra,đổi trả hoàn tiền bảo hành,"quần có chất liệu như thun có thể co giãn, nhưng mặc được 1 lần thì bị rách đường chỉ gần đáy quần [SEP] đổi trả hoàn tiền bảo hành",0
"đường chỉ rất dễ bị đứt, không hiểu sao mua 2 cái, cái nào cũng bị bung chỉ 2 bên dưới túi quần, kiểu quần thì đẹp mà không đi đôi với chất lượng, hên là phát hiện chứ không ng ta nhìn vào đánh giá sao nữa .",chat_luong,chất lượng tốt xấu thất vọng hài lòng,"đường chỉ rất dễ bị đứt, không hiểu sao mua 2 cái, cái nào cũng bị bung chỉ 2 bên dưới túi quần, kiểu quần thì đẹp mà không đi đôi với chất lượng, hên là phát hiện chứ không ng ta nhìn vào đánh giá sao nữa . [SEP] chất lượng tốt xấu thất vọng hài lòng",1
"hơi chật so với kích cỡ, quần chất mát nhưng kiểu dáng khá giống quần nữ, trên ống quần có bị may bóp vào không biết để lmj, trg vạc quần có gì đó cứng cứng khá giống nhựa, cửa hàng trò chuyện nhiệt tình",kich_co,kích cỡ size rộng chật ôm bó form rộng form nhỏ vừa người quần rộng quần chật áo rộng áo chật,"hơi chật so với kích cỡ, quần chất mát nhưng kiểu dáng khá giống quần nữ, trên ống quần có bị may bóp vào không biết để lmj, trg vạc quần có gì đó cứng cứng khá giống nhựa, cửa hàng trò chuyện nhiệt tình [SEP] kích cỡ size rộng chật ôm bó form rộng form nhỏ vừa người quần rộng quần chật áo rộng áo chật",1
cửa hàng nhiệt tình mình mua hộ đứa e .chất lượng ok.trời đất.gửi về mà quần không có khóa sao mặc,dong_goi,đóng gói bao bì đóng hộp,cửa hàng nhiệt tình mình mua hộ đứa e .chất lượng ok.trời đất.gửi về mà quần không có khóa sao mặc [SEP] đóng gói bao bì đóng hộp,0
với giá này thì quần ổn nhưng mà vải ủi xíu cháy mất nên thôi bỏ với giá này chịu thôiii,gia_ca,giá giá tiền mắc rẻ,với giá này thì quần ổn nhưng mà vải ủi xíu cháy mất nên thôi bỏ với giá này chịu thôiii [SEP] giá giá tiền mắc rẻ,1
số đo khác hoàn toàn so với bảng kích cỡ nhắn tin thì nửa ngày mới trả lời được cái quần đẹp so với giá tiền,dong_goi,đóng gói bao bì đóng hộp,số đo khác hoàn toàn so với bảng kích cỡ nhắn tin thì nửa ngày mới trả lời được cái quần đẹp so với giá tiền [SEP] đóng gói bao bì đóng hộp,0
"chất vải cũng tốt dày, chỉ thừa hơi nhiều quần vừa lấy xong đã bung luôn cúc rất xấu trừ điểm vì chỉ thừa",gia_cong,đường may gia công chỉ may,"chất vải cũng tốt dày, chỉ thừa hơi nhiều quần vừa lấy xong đã bung luôn cúc rất xấu trừ điểm vì chỉ thừa [SEP] đường may gia công chỉ may",1
"khá tốt ống quần hơi rộng làm cho cảm giác chân mình ngắn đi giao hàng nhanh, giá rẻ👌👌👌 h a và vd mang tính nhận xu 👌",giao_hang,ship giao hàng vận chuyển giao lâu,"khá tốt ống quần hơi rộng làm cho cảm giác chân mình ngắn đi giao hàng nhanh, giá rẻ👌👌👌 h a và vd mang tính nhận xu 👌 [SEP] ship giao hàng vận chuyển giao lâu",1
số đo so với số 31 chỗ khác hơi nhỏ mặt trước quần bị gập thế này chỉ đáng 2 sao và mặc được 1 tháng thì thấy bị sổ bông nữa,gia_ca,giá giá tiền mắc rẻ,số đo so với số 31 chỗ khác hơi nhỏ mặt trước quần bị gập thế này chỉ đáng 2 sao và mặc được 1 tháng thì thấy bị sổ bông nữa [SEP] giá giá tiền mắc rẻ,0
"lúc đầu mở ra không để ý kỹ, sau khi dùng 1 lần thì thấy đáy quần bị thủng 1 lỗ nhỏ thủng không phải rách đáy . tuy là vải quần rất đẹp",chat_lieu,vải chất liệu vải thun cotton jean kaki,"lúc đầu mở ra không để ý kỹ, sau khi dùng 1 lần thì thấy đáy quần bị thủng 1 lỗ nhỏ thủng không phải rách đáy . tuy là vải quần rất đẹp [SEP] vải chất liệu vải thun cotton jean kaki",1
"giao hàng nhanh. cửa hàng giao đúng số lượng, đúng mẫu. quần siêu đẹp chất vải dày dặn, mềm mại. kiểu dáng quần đẹp đường may chắc chắn. không khác gì so với hàng đặt may. được tặng kèm 1 áo giữ nhiệt hàng tặng kèm nhưng chất lượng cũng siêu ưng, chất vải dày dặn rất luôn ạ ❤️🥰😘😘❤️",chat_lieu,vải chất liệu vải thun cotton jean kaki,"giao hàng nhanh. cửa hàng giao đúng số lượng, đúng mẫu. quần siêu đẹp chất vải dày dặn, mềm mại. kiểu dáng quần đẹp đường may chắc chắn. không khác gì so với hàng đặt may. được tặng kèm 1 áo giữ nhiệt hàng tặng kèm nhưng chất lượng cũng siêu ưng, chất vải dày dặn rất luôn ạ ❤️🥰😘😘❤️ [SEP] vải chất liệu vải thun cotton jean kaki",1
vải mềm nhưng rất rộng may không đẹp lỡ mua lần đầu mà thấy không hợp nên chắc là lần cuối mua luôn,kieu_dang,kiểu dáng form thiết kế mẫu,vải mềm nhưng rất rộng may không đẹp lỡ mua lần đầu mà thấy không hợp nên chắc là lần cuối mua luôn [SEP] kiểu dáng form thiết kế mẫu,0
"vải êm, mát, màu quần đẹp tuy nhiên, ống quần hơi rộng, bị thụng, lưng quần cũng hơi rộng",chat_luong,chất lượng tốt xấu thất vọng hài lòng,"vải êm, mát, màu quần đẹp tuy nhiên, ống quần hơi rộng, bị thụng, lưng quần cũng hơi rộng [SEP] chất lượng tốt xấu thất vọng hài lòng",0
"chất liệu vải tốt, mềm mịn, có độ co giãn tốt, không có dấu hiệu bung chỉ, lưng quần cứng cáp chuẩn, phần túi được may bằng lời vải lụa khá cao cấp so với các loại quần bán ngoài chợ, đường chỉ được may bích lại rất cẩn thận, theo cảm nhận of me thì túi chỉ vừa chuẩn chứ không rất rộng, nói chung là sp rất hợp với giá tiền, theo mik thì 9 10. chúc cửa hàng thành công và bán đắt hơn",do_ben,độ bền bền rách bung hỏng,"chất liệu vải tốt, mềm mịn, có độ co giãn tốt, không có dấu hiệu bung chỉ, lưng quần cứng cáp chuẩn, phần túi được may bằng lời vải lụa khá cao cấp so với các loại quần bán ngoài chợ, đường chỉ được may bích lại rất cẩn thận, theo cảm nhận of me thì túi chỉ vừa chuẩn chứ không rất rộng, nói chung là sp rất hợp với giá tiền, theo mik thì 9 10. chúc cửa hàng thành công và bán đắt hơn [SEP] độ bền bền rách bung hỏng",0
chất liệu tốt nhưng mới mặt đã đứt chỉ,do_ben,độ bền bền rách bung hỏng,chất liệu tốt nhưng mới mặt đã đứt chỉ [SEP] độ bền bền rách bung hỏng,1
quần hơi mỏng í với mọi khi mag kích cỡ 34 vừa mà giờ đặt 34 rộng rất với hơi ngắn,doi_tra,đổi trả hoàn tiền bảo hành,quần hơi mỏng í với mọi khi mag kích cỡ 34 vừa mà giờ đặt 34 rộng rất với hơi ngắn [SEP] đổi trả hoàn tiền bảo hành,0
áo không có mác . nhăn nhó như của ai đó mang nhiều lần rồi . lần đầu cũng như lần cuối mua hàng,chat_lieu,vải chất liệu vải thun cotton jean kaki,áo không có mác . nhăn nhó như của ai đó mang nhiều lần rồi . lần đầu cũng như lần cuối mua hàng [SEP] vải chất liệu vải thun cotton jean kaki,0
giao hàng lâu ạ. nhưng đóng gói đẹp chất liệu vải khá ổn hình ảnh chỉ mang tính chất nhận xu,chat_lieu,vải chất liệu vải thun cotton jean kaki,giao hàng lâu ạ. nhưng đóng gói đẹp chất liệu vải khá ổn hình ảnh chỉ mang tính chất nhận xu [SEP] vải chất liệu vải thun cotton jean kaki,1
"vải ổn, mát, không dày lắm, nhưng đỉa quần sau 1 tuần mặc thì bị bung chỉ và đứt, ảnh này là tui đã tự khâu lại rồi, quên chụp ảnh lúc bị đứt",kich_co,kích cỡ size rộng chật ôm bó form rộng form nhỏ vừa người quần rộng quần chật áo rộng áo chật,"vải ổn, mát, không dày lắm, nhưng đỉa quần sau 1 tuần mặc thì bị bung chỉ và đứt, ảnh này là tui đã tự khâu lại rồi, quên chụp ảnh lúc bị đứt [SEP] kích cỡ size rộng chật ôm bó form rộng form nhỏ vừa người quần rộng quần chật áo rộng áo chật",0
"thật sự mở sản phẩm ra thấy bao đựng đầy đủ mà mở ra hết cả hồn, mình không biết cửa hàng packing hay để ở đâu mà thành ra như vậy mình khá thất vọng khi nhận hàng và không muốn thử vì rất nhiều kiến lửa. đây là lần đầu mình bị và cũng là lần cuối, mình đăng lên để mọi người và cửa hàng cẩn thận hơn nhé. mình cảm ơn.",dong_goi,đóng gói bao bì đóng hộp,"thật sự mở sản phẩm ra thấy bao đựng đầy đủ mà mở ra hết cả hồn, mình không biết cửa hàng packing hay để ở đâu mà thành ra như vậy mình khá thất vọng khi nhận hàng và không muốn thử vì rất nhiều kiến lửa. đây là lần đầu mình bị và cũng là lần cuối, mình đăng lên để mọi người và cửa hàng cẩn thận hơn nhé. mình cảm ơn. [SEP] đóng gói bao bì đóng hộp",1
"mua nguyên 1 sét này luôn cả áo với quần kêta hợp đẹp ,mặc vừa mà tôn dáng lắm í ,chất vải đẹp rất ít chỉ thừa ,ưng rất cửa hàng ạ ,cảm ơn cửa hàng nhiều😚😘😘😘😘😘😘😜😜😜😜😜😜😜😜",gia_ca,giá giá tiền mắc rẻ,"mua nguyên 1 sét này luôn cả áo với quần kêta hợp đẹp ,mặc vừa mà tôn dáng lắm í ,chất vải đẹp rất ít chỉ thừa ,ưng rất cửa hàng ạ ,cảm ơn cửa hàng nhiều😚😘😘😘😘😘😘😜😜😜😜😜😜😜😜 [SEP] giá giá tiền mắc rẻ",0
"lúc giao hàng cho mình thì mở ra xem thấy quần bị rách nhỏ ở phần ống,bù lại chất lượng khá tốt",kieu_dang,kiểu dáng form thiết kế mẫu,"lúc giao hàng cho mình thì mở ra xem thấy quần bị rách nhỏ ở phần ống,bù lại chất lượng khá tốt [SEP] kiểu dáng form thiết kế mẫu",0
"cửa hàng làm ăn kiểu gì kì cục nghĩ sao đi giao quần đã mặt rồi cho khách. quần này mình đặt dùm nên lúc khui hàng mình cũng tin tưởng cửa hàng nên cũng không quay lại, làm mất mặt thật sự.",chat_lieu,vải chất liệu vải thun cotton jean kaki,"cửa hàng làm ăn kiểu gì kì cục nghĩ sao đi giao quần đã mặt rồi cho khách. quần này mình đặt dùm nên lúc khui hàng mình cũng tin tưởng cửa hàng nên cũng không quay lại, làm mất mặt thật sự. [SEP] vải chất liệu vải thun cotton jean kaki",0
"đặt hoả tốc nút ẩn trắng, giao trắng tinh nút lộ, màu trắng nó giả trân, nhắn tin thì kêu hỗ trợ đổi, tưởng thế nào kêu nhấn thht rồi đặt lại đơn khác vậy ngta đặt hoả tốc làm gì. vải thì mềm nhưng dễ nhăn và không có thoáng khí như mô tả nha, giá này thì mấy bạn sinh viên mua tốt còn mua đi làm hoặc mặc đi sự kiện thì cân nhắc",mau_sac,màu sắc màu màu sắc đẹp xấu đậm nhạt phai màu khác màu,"đặt hoả tốc nút ẩn trắng, giao trắng tinh nút lộ, màu trắng nó giả trân, nhắn tin thì kêu hỗ trợ đổi, tưởng thế nào kêu nhấn thht rồi đặt lại đơn khác vậy ngta đặt hoả tốc làm gì. vải thì mềm nhưng dễ nhăn và không có thoáng khí như mô tả nha, giá này thì mấy bạn sinh viên mua tốt còn mua đi làm hoặc mặc đi sự kiện thì cân nhắc [SEP] màu sắc màu màu sắc đẹp xấu đậm nhạt phai màu khác màu",1
quần đẹp so với số tiền bỏ ra nhưng may phần đường may đáy hơi chật và còn tư vấn kích cỡ rất xấu đặt kích cỡ 28 mà quần như kích cỡ 30 mọi người cân nhắc trc khi đặt nên giảm lui 1 2 kích cỡ,mau_sac,màu sắc màu màu sắc đẹp xấu đậm nhạt phai màu khác màu,quần đẹp so với số tiền bỏ ra nhưng may phần đường may đáy hơi chật và còn tư vấn kích cỡ rất xấu đặt kích cỡ 28 mà quần như kích cỡ 30 mọi người cân nhắc trc khi đặt nên giảm lui 1 2 kích cỡ [SEP] màu sắc màu màu sắc đẹp xấu đậm nhạt phai màu khác màu,0
mỏng với không đứng fomr tí nào,kieu_dang,kiểu dáng form thiết kế mẫu,mỏng với không đứng fomr tí nào [SEP] kiểu dáng form thiết kế mẫu,1
mua kích cỡ 29 mà lưng rất rộng,kich_co,kích cỡ size rộng chật ôm bó form rộng form nhỏ vừa người quần rộng quần chật áo rộng áo chật,mua kích cỡ 29 mà lưng rất rộng [SEP] kích cỡ size rộng chật ôm bó form rộng form nhỏ vừa người quần rộng quần chật áo rộng áo chật,1
mua 3 cái 3 cái khác nhau hết,uy_tin_cua_hang,uy tín shop cửa hàng đáng tin,mua 3 cái 3 cái khác nhau hết [SEP] uy tín shop cửa hàng đáng tin,1
quần mua về không có cúc chỗ khóa quần thì bị rách bù lại dịch vụ chăm sóc khách hàng tốt,cham_soc_khach_hang,tư vấn chăm sóc khách hàng rep tin nhắn phản hồi hỗ trợ trả lời chậm thái độ nhân viên,quần mua về không có cúc chỗ khóa quần thì bị rách bù lại dịch vụ chăm sóc khách hàng tốt [SEP] tư vấn chăm sóc khách hàng rep tin nhắn phản hồi hỗ trợ trả lời chậm thái độ nhân viên,1
"giao hàng nhanh, đóng gói ổn, nhưng kích cỡ quần thì không chuẩn lắm, bị chật ý ạ. không biết phải làm sao cơ. em đi mua tặng mà giờ mặc không nổi",cham_soc_khach_hang,tư vấn chăm sóc khách hàng rep tin nhắn phản hồi hỗ trợ trả lời chậm thái độ nhân viên,"giao hàng nhanh, đóng gói ổn, nhưng kích cỡ quần thì không chuẩn lắm, bị chật ý ạ. không biết phải làm sao cơ. em đi mua tặng mà giờ mặc không nổi [SEP] tư vấn chăm sóc khách hàng rep tin nhắn phản hồi hỗ trợ trả lời chậm thái độ nhân viên",0
chất liệu vải không phù hợp,gia_ca,giá giá tiền mắc rẻ,chất liệu vải không phù hợp [SEP] giá giá tiền mắc rẻ,0
chất quần đợt này không dày với mịn như đợt truớc mình mua. giao nhanh. đóng gói tốt so với tầm giá thì cửa hàng này vẫn rất tốt,kieu_dang,kiểu dáng form thiết kế mẫu,chất quần đợt này không dày với mịn như đợt truớc mình mua. giao nhanh. đóng gói tốt so với tầm giá thì cửa hàng này vẫn rất tốt [SEP] kiểu dáng form thiết kế mẫu,0
quần đẹp so với số tiền bỏ ra nhưng may phần đường may đáy hơi chật và còn tư vấn kích cỡ rất xấu đặt kích cỡ 28 mà quần như kích cỡ 30 mọi người cân nhắc trc khi đặt nên giảm lui 1 2 kích cỡ,cham_soc_khach_hang,tư vấn chăm sóc khách hàng rep tin nhắn phản hồi hỗ trợ trả lời chậm thái độ nhân viên,quần đẹp so với số tiền bỏ ra nhưng may phần đường may đáy hơi chật và còn tư vấn kích cỡ rất xấu đặt kích cỡ 28 mà quần như kích cỡ 30 mọi người cân nhắc trc khi đặt nên giảm lui 1 2 kích cỡ [SEP] tư vấn chăm sóc khách hàng rep tin nhắn phản hồi hỗ trợ trả lời chậm thái độ nhân viên,1
sai màu nhưng thôi dùng tạm hoãn hỉ,kich_co,kích cỡ size rộng chật ôm bó form rộng form nhỏ vừa người quần rộng quần chật áo rộng áo chật,sai màu nhưng thôi dùng tạm hoãn hỉ [SEP] kích cỡ size rộng chật ôm bó form rộng form nhỏ vừa người quần rộng quần chật áo rộng áo chật,0
vải dày dặn nhưng mà bị lỗi nè kiểu dáng xấu với lại bị vải bị bung r,kich_co,kích cỡ size rộng chật ôm bó form rộng form nhỏ vừa người quần rộng quần chật áo rộng áo chật,vải dày dặn nhưng mà bị lỗi nè kiểu dáng xấu với lại bị vải bị bung r [SEP] kích cỡ size rộng chật ôm bó form rộng form nhỏ vừa người quần rộng quần chật áo rộng áo chật,0
"quần mua về dính những vết dơ giặc mãi không ra, quần màu kem mà dơ thì chịu luôn, vậy mà cửa hàng vẫn giao cho khách, làm ăn không có tâm.",dong_goi,đóng gói bao bì đóng hộp,"quần mua về dính những vết dơ giặc mãi không ra, quần màu kem mà dơ thì chịu luôn, vậy mà cửa hàng vẫn giao cho khách, làm ăn không có tâm. [SEP] đóng gói bao bì đóng hộp",0
chất lượng khá xấu sau khi mặc và giặt 1 lần thì sản phẩm bị xù lông. chất lượng đường may xấu,gia_cong,đường may gia công chỉ may,chất lượng khá xấu sau khi mặc và giặt 1 lần thì sản phẩm bị xù lông. chất lượng đường may xấu [SEP] đường may gia công chỉ may,1
thái độ phục vụ hời hợt. nhắn tin kêu sửa đánh giá 5sao thì mau mắn còn khi mình nt thắc mắc thì cả ngày chưa thấy trả lời chưa kể đặt hàng bị lỗi không giao mà không thông báo. 1 sao và không có lần sau:,gia_cong,đường may gia công chỉ may,thái độ phục vụ hời hợt. nhắn tin kêu sửa đánh giá 5sao thì mau mắn còn khi mình nt thắc mắc thì cả ngày chưa thấy trả lời chưa kể đặt hàng bị lỗi không giao mà không thông báo. 1 sao và không có lần sau: [SEP] đường may gia công chỉ may,0
"chất vải phù hợp với giá tiền. kích cỡ 32 mà 70kg mặc chật bụng rất không vừa., ống quần hơi ngắn, là không kỹ",kieu_dang,kiểu dáng form thiết kế mẫu,"chất vải phù hợp với giá tiền. kích cỡ 32 mà 70kg mặc chật bụng rất không vừa., ống quần hơi ngắn, là không kỹ [SEP] kiểu dáng form thiết kế mẫu",0
"lần trước mình mua áo sơ mi cho any thấy tốt giờ mua thêm cái áo cho mình và quất thêm vài cái quần cho any để thành bộ mặc cho xinh xẻo. vải quần khá mát, mịn kể cả áo cũng vậy luôn nha. any mình cao 1m75 và nặng 73kg mặc kích cỡ 33 đó ạ. quần màu đen vừa vặn, màu kem và xám eo rộng hơn đốt ngón tay.",kieu_dang,kiểu dáng form thiết kế mẫu,"lần trước mình mua áo sơ mi cho any thấy tốt giờ mua thêm cái áo cho mình và quất thêm vài cái quần cho any để thành bộ mặc cho xinh xẻo. vải quần khá mát, mịn kể cả áo cũng vậy luôn nha. any mình cao 1m75 và nặng 73kg mặc kích cỡ 33 đó ạ. quần màu đen vừa vặn, màu kem và xám eo rộng hơn đốt ngón tay. [SEP] kiểu dáng form thiết kế mẫu",0
lộn hàng mất thời gian mua hàng 189 giao 159 lộn khôn thế quần thì rộng cố ý giao lộn rõ ràng,chat_lieu,vải chất liệu vải thun cotton jean kaki,lộn hàng mất thời gian mua hàng 189 giao 159 lộn khôn thế quần thì rộng cố ý giao lộn rõ ràng [SEP] vải chất liệu vải thun cotton jean kaki,0
"chất lượng tạm ổn, có điều mua hôm nay giá 220k đến khi nhận hàng thì cửa hàng giảm còn 179k, hơi cay kiểu bán hàng này",kieu_dang,kiểu dáng form thiết kế mẫu,"chất lượng tạm ổn, có điều mua hôm nay giá 220k đến khi nhận hàng thì cửa hàng giảm còn 179k, hơi cay kiểu bán hàng này [SEP] kiểu dáng form thiết kế mẫu",0
tôi mua 2 loại rồi . trên cửa hàng nay giá tiền khác nhau mà sân phẩm là giống nhau. với màu này không phải là màu kem . hình như là màu ghi thôi,mau_sac,màu sắc màu màu sắc đẹp xấu đậm nhạt phai màu khác màu,tôi mua 2 loại rồi . trên cửa hàng nay giá tiền khác nhau mà sân phẩm là giống nhau. với màu này không phải là màu kem . hình như là màu ghi thôi [SEP] màu sắc màu màu sắc đẹp xấu đậm nhạt phai màu khác màu,1
"mua theo kích cỡ cửa hàng đưa mà rất chật kéo lên nhìn thộn thộn đúng kì, được cái vải tốt mặc rồi giặt vài lần thấy tốt hơn rồi, mà ngay chỗ kéo khoá vẫn xấu xấu may lỗi hay sao ấy, cửa hàng có liên lạc hỗ trợ đổi mà lúc nhận hàng đang gấp mặc luôn rồi còn đâu: nói chung khá ổn nên tăng thêm 1 sao",doi_tra,đổi trả hoàn tiền bảo hành,"mua theo kích cỡ cửa hàng đưa mà rất chật kéo lên nhìn thộn thộn đúng kì, được cái vải tốt mặc rồi giặt vài lần thấy tốt hơn rồi, mà ngay chỗ kéo khoá vẫn xấu xấu may lỗi hay sao ấy, cửa hàng có liên lạc hỗ trợ đổi mà lúc nhận hàng đang gấp mặc luôn rồi còn đâu: nói chung khá ổn nên tăng thêm 1 sao [SEP] đổi trả hoàn tiền bảo hành",0
"chất liêu tốt nhưng dùng vài ngày thì bung chỉ, biết giữ tốt là được",gia_ca,giá giá tiền mắc rẻ,"chất liêu tốt nhưng dùng vài ngày thì bung chỉ, biết giữ tốt là được [SEP] giá giá tiền mắc rẻ",0
"tư vấn thì bị rộng kích cỡ giao thì nhanh, mà đổi hàng thi tới 17 ngày làm ăn không hiểu được",chat_lieu,vải chất liệu vải thun cotton jean kaki,"tư vấn thì bị rộng kích cỡ giao thì nhanh, mà đổi hàng thi tới 17 ngày làm ăn không hiểu được [SEP] vải chất liệu vải thun cotton jean kaki",0
"sản phẩm xấu đường may không tỉ mỉ dẫn đến bung chỉ, phần may xổ cũng bị bung dẫn đến bung luôn sợi vải, nhiều chỉ thừa, vải mềm mỏng",kich_co,kích cỡ size rộng chật ôm bó form rộng form nhỏ vừa người quần rộng quần chật áo rộng áo chật,"sản phẩm xấu đường may không tỉ mỉ dẫn đến bung chỉ, phần may xổ cũng bị bung dẫn đến bung luôn sợi vải, nhiều chỉ thừa, vải mềm mỏng [SEP] kích cỡ size rộng chật ôm bó form rộng form nhỏ vừa người quần rộng quần chật áo rộng áo chật",0
