sentence,aspect,description,input_text,label
hàng đẹp giao hàng nhanh chóng chất vài hợp lý với giá tiền đẹp mát mọi người nên mua nhé,cham_soc_khach_hang,tư vấn chăm sóc khách hàng rep tin nhắn phản hồi hỗ trợ trả lời chậm thái độ nhân viên,hàng đẹp giao hàng nhanh chóng chất vài hợp lý với giá tiền đẹp mát mọi người nên mua nhé [SEP] tư vấn chăm sóc khách hàng rep tin nhắn phản hồi hỗ trợ trả lời chậm thái độ nhân viên,0
mới mở hàng đã sút chỉ ở ống quần. sản phẩm đẹp dày dặn nhưng mới mua về đã bị sút chỉ.,chat_lieu,vải chất liệu vải thun cotton jean kaki,mới mở hàng đã sút chỉ ở ống quần. sản phẩm đẹp dày dặn nhưng mới mua về đã bị sút chỉ. [SEP] vải chất liệu vải thun cotton jean kaki,1
mặc kiểu dáng tốt nhưng chưa mặc hết một ngày thì lại bị bung chỉ ở bên hông,do_ben,độ bền bền rách bung hỏng,mặc kiểu dáng tốt nhưng chưa mặc hết một ngày thì lại bị bung chỉ ở bên hông [SEP] độ bền bền rách bung hỏng,1
"giao hàng nhanh, đổi kích cỡ cũng rất nhanh gọn, đóng gói cẩn thận. quần lên kiểu dáng rất đẹp dáng quần baggy khá thoải mái.",dong_goi,đóng gói bao bì đóng hộp,"giao hàng nhanh, đổi kích cỡ cũng rất nhanh gọn, đóng gói cẩn thận. quần lên kiểu dáng rất đẹp dáng quần baggy khá thoải mái. [SEP] đóng gói bao bì đóng hộp",1
"nhiều lần mua sp ở cửa hàng giao hàng nhanh, đóng gói cẩn thận. quần vải chất lượng, đường chỉ đẹp mặc rất thoải mái. rất chim ưng quần trong tầm giá này. ủng hộ nhiệt tình",chat_lieu,vải chất liệu vải thun cotton jean kaki,"nhiều lần mua sp ở cửa hàng giao hàng nhanh, đóng gói cẩn thận. quần vải chất lượng, đường chỉ đẹp mặc rất thoải mái. rất chim ưng quần trong tầm giá này. ủng hộ nhiệt tình [SEP] vải chất liệu vải thun cotton jean kaki",1
"quần hơi ngắn tui m8 bận kích cỡ 31 trên mắc cá 1 khúc lun á, mấy bạn cao cao mà óm óm cân nhắc nha",kich_co,kích cỡ size rộng chật ôm bó form rộng form nhỏ vừa người quần rộng quần chật áo rộng áo chật,"quần hơi ngắn tui m8 bận kích cỡ 31 trên mắc cá 1 khúc lun á, mấy bạn cao cao mà óm óm cân nhắc nha [SEP] kích cỡ size rộng chật ôm bó form rộng form nhỏ vừa người quần rộng quần chật áo rộng áo chật",1
"rất ưng nhé cửa hàng chỉ hơn 100k từ đường kim mũi chỉ, chất vải dày dặn. yên tâm hơn nữa với mác cùng với thư cảm ơn của cửa hàng sẽ ủng hộ thêm",chat_lieu,vải chất liệu vải thun cotton jean kaki,"rất ưng nhé cửa hàng chỉ hơn 100k từ đường kim mũi chỉ, chất vải dày dặn. yên tâm hơn nữa với mác cùng với thư cảm ơn của cửa hàng sẽ ủng hộ thêm [SEP] vải chất liệu vải thun cotton jean kaki",1
"vải quần bị xúc sổ, sờn chỉ, may sơ sài, không đẹp như mong đợi, cửa hàng giao hàng nhanh.",doi_tra,đổi trả hoàn tiền bảo hành,"vải quần bị xúc sổ, sờn chỉ, may sơ sài, không đẹp như mong đợi, cửa hàng giao hàng nhanh. [SEP] đổi trả hoàn tiền bảo hành",0
"quần đẹp vải đẹp tuy nhiên trải nghiệm dịch vụ rất kém. mình đã nhắn tin với cửa hàng nhờ lên gấu nhưng cửa hàng không làm, thà đừng sinh thêm dv thì vẫn vui vẻ mang quần đi sửa nhưng đã có thêm để thu hút không mà không thực hiện thì thực sự mang đến cảm giác rất không tốt.",do_ben,độ bền bền rách bung hỏng,"quần đẹp vải đẹp tuy nhiên trải nghiệm dịch vụ rất kém. mình đã nhắn tin với cửa hàng nhờ lên gấu nhưng cửa hàng không làm, thà đừng sinh thêm dv thì vẫn vui vẻ mang quần đi sửa nhưng đã có thêm để thu hút không mà không thực hiện thì thực sự mang đến cảm giác rất không tốt. [SEP] độ bền bền rách bung hỏng",0
"vải đẹp kiểu dáng rộng thoải mái. mình chọn kích cỡ 32 hơi rộng so với quần mình hay mặc. nhưng đường chỉ may dễ đứt dễ rách. mình mới mặc, ngồi xuống đã sứt chỉ.",kich_co,kích cỡ size rộng chật ôm bó form rộng form nhỏ vừa người quần rộng quần chật áo rộng áo chật,"vải đẹp kiểu dáng rộng thoải mái. mình chọn kích cỡ 32 hơi rộng so với quần mình hay mặc. nhưng đường chỉ may dễ đứt dễ rách. mình mới mặc, ngồi xuống đã sứt chỉ. [SEP] kích cỡ size rộng chật ôm bó form rộng form nhỏ vừa người quần rộng quần chật áo rộng áo chật",1
"vải ổn nhưng màu khác so với ảnh , không đúng kích cỡ cửa hàng để",mau_sac,màu sắc màu màu sắc đẹp xấu đậm nhạt phai màu khác màu,"vải ổn nhưng màu khác so với ảnh , không đúng kích cỡ cửa hàng để [SEP] màu sắc màu màu sắc đẹp xấu đậm nhạt phai màu khác màu",1
quà đi tặng nên không rõ chất lượng nhưng màu ghi không đúng với màu mình mong muốn như hình lắm. giao hàng nhanh,chat_lieu,vải chất liệu vải thun cotton jean kaki,quà đi tặng nên không rõ chất lượng nhưng màu ghi không đúng với màu mình mong muốn như hình lắm. giao hàng nhanh [SEP] vải chất liệu vải thun cotton jean kaki,0
"quần bị bẩn với chỉ thừa nhiều, quần chưa mặc đã bị bung cúc. sản phẩn không đúng với quảng cáo",dong_goi,đóng gói bao bì đóng hộp,"quần bị bẩn với chỉ thừa nhiều, quần chưa mặc đã bị bung cúc. sản phẩn không đúng với quảng cáo [SEP] đóng gói bao bì đóng hộp",0
"vải tạm , mọi người nên đặt lùi 1 kích cỡ vì nó rộng lắm luôn :",kich_co,kích cỡ size rộng chật ôm bó form rộng form nhỏ vừa người quần rộng quần chật áo rộng áo chật,"vải tạm , mọi người nên đặt lùi 1 kích cỡ vì nó rộng lắm luôn : [SEP] kích cỡ size rộng chật ôm bó form rộng form nhỏ vừa người quần rộng quần chật áo rộng áo chật",1
chất lượng sản phẩm rất xất đóng gói sản phẩm rất đẹp và chắc chắn giao hàng nhanh,dong_goi,đóng gói bao bì đóng hộp,chất lượng sản phẩm rất xất đóng gói sản phẩm rất đẹp và chắc chắn giao hàng nhanh [SEP] đóng gói bao bì đóng hộp,1
"quần kiểu dáng xấu mặc nóng, mua 2 cái cùng 1 kích cỡ nhưng cái rộng cái chật. không đáng để mua",do_ben,độ bền bền rách bung hỏng,"quần kiểu dáng xấu mặc nóng, mua 2 cái cùng 1 kích cỡ nhưng cái rộng cái chật. không đáng để mua [SEP] độ bền bền rách bung hỏng",0
"mua cái quần đầu tiên mặc thì tốt đến mua cái quần thứ 2 thì mặc được 3 buổi là xù hết vải, thất vọng sẽ không ủng hộ nữa",chat_luong,chất lượng tốt xấu thất vọng hài lòng,"mua cái quần đầu tiên mặc thì tốt đến mua cái quần thứ 2 thì mặc được 3 buổi là xù hết vải, thất vọng sẽ không ủng hộ nữa [SEP] chất lượng tốt xấu thất vọng hài lòng",1
cửa hàng này lừa đảo đổi trả hàng nhé 🤔 đã nhận hàng đổi trả bên bưu điện mà lại khăng khăng không nhận .mọi người né cửa hàng này ra nhé ăn chặn hàng của khách đấy,uy_tin_cua_hang,uy tín shop cửa hàng đáng tin,cửa hàng này lừa đảo đổi trả hàng nhé 🤔 đã nhận hàng đổi trả bên bưu điện mà lại khăng khăng không nhận .mọi người né cửa hàng này ra nhé ăn chặn hàng của khách đấy [SEP] uy tín shop cửa hàng đáng tin,1
"mua lần thứ 2, kiểu dáng quần hơi rộng, chỉ hơi dễ sứt nhưng giá thành vậy là rất hợp lí",giao_hang,ship giao hàng vận chuyển giao lâu,"mua lần thứ 2, kiểu dáng quần hơi rộng, chỉ hơi dễ sứt nhưng giá thành vậy là rất hợp lí [SEP] ship giao hàng vận chuyển giao lâu",0
quần đẹp đóng gói ổn. giao hàng siêu nhanh. nhưng chỉ thừa nhiều.,dong_goi,đóng gói bao bì đóng hộp,quần đẹp đóng gói ổn. giao hàng siêu nhanh. nhưng chỉ thừa nhiều. [SEP] đóng gói bao bì đóng hộp,1
sản phẩm chất lượng phù hợp giá tiền giá sản phẩm cạnh tranh ổn,gia_ca,giá giá tiền mắc rẻ,sản phẩm chất lượng phù hợp giá tiền giá sản phẩm cạnh tranh ổn [SEP] giá giá tiền mắc rẻ,1
"mới mặc lần đầu gập lên xuống đã đứt chỉ, mua sale giá tính ra 120k 1 quần, chất vải dày dặn màu sắc tươi, có điều đường may yếu rất nên đánh giá không cao nha",chat_lieu,vải chất liệu vải thun cotton jean kaki,"mới mặc lần đầu gập lên xuống đã đứt chỉ, mua sale giá tính ra 120k 1 quần, chất vải dày dặn màu sắc tươi, có điều đường may yếu rất nên đánh giá không cao nha [SEP] vải chất liệu vải thun cotton jean kaki",1
"quần rất đẹp , chất liệu quần mặc rất dễ chịu rộng rãi thoáng mát co dãn mặc phải nói là ưng lắm luôn phải công nhận là rất tuyệ vời hihii",chat_luong,chất lượng tốt xấu thất vọng hài lòng,"quần rất đẹp , chất liệu quần mặc rất dễ chịu rộng rãi thoáng mát co dãn mặc phải nói là ưng lắm luôn phải công nhận là rất tuyệ vời hihii [SEP] chất lượng tốt xấu thất vọng hài lòng",1
"quần màu đẹp ổn nhưng chỉ may không được đều , cúc quần khâu không được kĩ , chỉ thừa nhiều",mau_sac,màu sắc màu màu sắc đẹp xấu đậm nhạt phai màu khác màu,"quần màu đẹp ổn nhưng chỉ may không được đều , cúc quần khâu không được kĩ , chỉ thừa nhiều [SEP] màu sắc màu màu sắc đẹp xấu đậm nhạt phai màu khác màu",1
hàng ok giao hàng chậm trả lời tin nhắn chậm,dong_goi,đóng gói bao bì đóng hộp,hàng ok giao hàng chậm trả lời tin nhắn chậm [SEP] đóng gói bao bì đóng hộp,0
"khá tốt ống quần hơi rộng làm cho cảm giác chân mình ngắn đi giao hàng nhanh, giá rẻ👌👌👌 h a và vd mang tính nhận xu 👌",gia_ca,giá giá tiền mắc rẻ,"khá tốt ống quần hơi rộng làm cho cảm giác chân mình ngắn đi giao hàng nhanh, giá rẻ👌👌👌 h a và vd mang tính nhận xu 👌 [SEP] giá giá tiền mắc rẻ",1
giao thiếu hàng,chat_lieu,vải chất liệu vải thun cotton jean kaki,giao thiếu hàng [SEP] vải chất liệu vải thun cotton jean kaki,0
quần đẹp mới mở ra đã bị bung chỉ gấu quần rồi,gia_cong,đường may gia công chỉ may,quần đẹp mới mở ra đã bị bung chỉ gấu quần rồi [SEP] đường may gia công chỉ may,1
"cửa hàng giao hàng nhanh. quần tốt với giá tiền không đòi hỏi hơn. điểm trừ cho hình ảnh với quần thật không giống nhau, ở chỗ cạp quần nhìn không vừa mắt như ông già, cúc cài và khóa quần không giống ảnh. chỉ quần và ông quần rối và không chắc",dong_goi,đóng gói bao bì đóng hộp,"cửa hàng giao hàng nhanh. quần tốt với giá tiền không đòi hỏi hơn. điểm trừ cho hình ảnh với quần thật không giống nhau, ở chỗ cạp quần nhìn không vừa mắt như ông già, cúc cài và khóa quần không giống ảnh. chỉ quần và ông quần rối và không chắc [SEP] đóng gói bao bì đóng hộp",0
giao đúng mẫu và kích cỡ đóng gói tốt đã mua nhìu lần tốt nha vải và phom đẹp giá săn sale rất tốt luôn mọi người nên mua nha mình sẽ ủng hộ cửa hàng khi cần nữa nha thank cửa hàng nhìu nha,uy_tin_cua_hang,uy tín shop cửa hàng đáng tin,giao đúng mẫu và kích cỡ đóng gói tốt đã mua nhìu lần tốt nha vải và phom đẹp giá săn sale rất tốt luôn mọi người nên mua nha mình sẽ ủng hộ cửa hàng khi cần nữa nha thank cửa hàng nhìu nha [SEP] uy tín shop cửa hàng đáng tin,0
hàng bị rách,doi_tra,đổi trả hoàn tiền bảo hành,hàng bị rách [SEP] đổi trả hoàn tiền bảo hành,0
"chất liệu ổn, vải cũng không đẹp lắm, đường may còn nhiều chỉ thừa",gia_cong,đường may gia công chỉ may,"chất liệu ổn, vải cũng không đẹp lắm, đường may còn nhiều chỉ thừa [SEP] đường may gia công chỉ may",1
"cửa hàng này lì kinh khủng, lần 1 mua 2 cái 1xám 1 đen , thanh toán trước mà chỉ giao 1 đen, phản hồi thì mới trả lại tiền chứ cửa hàng im ru nếu không báo chắc cửa hàng cũng im luôn nhưng thấy hàng tốt nên xí xoá cho cửa hàng bỏ qua cho cửa hàng mua thêm 1 lần nữa. thì lần 2 mua xám vì lần 1 giao thiếu vậy mà lần 2 tiếp tục giao đen, cũng im ru không báo khách là hết hàng hết kích cỡ hay là như thế nào. cứ im im mà gửi thôi. cho 1 sao cho đáng đời. tết nhất mà soa làm bực mình ghê",doi_tra,đổi trả hoàn tiền bảo hành,"cửa hàng này lì kinh khủng, lần 1 mua 2 cái 1xám 1 đen , thanh toán trước mà chỉ giao 1 đen, phản hồi thì mới trả lại tiền chứ cửa hàng im ru nếu không báo chắc cửa hàng cũng im luôn nhưng thấy hàng tốt nên xí xoá cho cửa hàng bỏ qua cho cửa hàng mua thêm 1 lần nữa. thì lần 2 mua xám vì lần 1 giao thiếu vậy mà lần 2 tiếp tục giao đen, cũng im ru không báo khách là hết hàng hết kích cỡ hay là như thế nào. cứ im im mà gửi thôi. cho 1 sao cho đáng đời. tết nhất mà soa làm bực mình ghê [SEP] đổi trả hoàn tiền bảo hành",0
"sp vải cũng tốt rẻ trong tầm giá, có cái không thích là tl tin nhắn hơi chậm. khi đặt hàng bên cửa hàng tư vấn kích cỡ 31 mình sợ không vừa đặt 32 luôn nhưng về mặc vẫn không vừa, cửa hàng vẫn cho đổi trả nhưng phải chịu giao hàng 2 chìu mặc dù cửa hàng đã tư vấn kích cỡ cho mình",chat_lieu,vải chất liệu vải thun cotton jean kaki,"sp vải cũng tốt rẻ trong tầm giá, có cái không thích là tl tin nhắn hơi chậm. khi đặt hàng bên cửa hàng tư vấn kích cỡ 31 mình sợ không vừa đặt 32 luôn nhưng về mặc vẫn không vừa, cửa hàng vẫn cho đổi trả nhưng phải chịu giao hàng 2 chìu mặc dù cửa hàng đã tư vấn kích cỡ cho mình [SEP] vải chất liệu vải thun cotton jean kaki",1
mua lần đầu thì rất tốt lần này là thứ 2 mà thất vọng khoá quần bị tuột ra ngoài gồi phải đem đi sửa nữa 🥲,gia_cong,đường may gia công chỉ may,mua lần đầu thì rất tốt lần này là thứ 2 mà thất vọng khoá quần bị tuột ra ngoài gồi phải đem đi sửa nữa 🥲 [SEP] đường may gia công chỉ may,1
"không biết lần thứ bao nhiêu mua hàng của cửa hàng rồi vì hàng lần nào cũng chất lượng.quần mặc mát ống rộng suông đẹp,xăng tuya chắc chắn.mình cao 1m72 61kg mặc kích cỡ l vừa đẹp.giá thành rẻ hơn thị trường rất nhiều.recommend mua thêm áo sơ mi của cửa hàng mặc combo cho chất nha",kieu_dang,kiểu dáng form thiết kế mẫu,"không biết lần thứ bao nhiêu mua hàng của cửa hàng rồi vì hàng lần nào cũng chất lượng.quần mặc mát ống rộng suông đẹp,xăng tuya chắc chắn.mình cao 1m72 61kg mặc kích cỡ l vừa đẹp.giá thành rẻ hơn thị trường rất nhiều.recommend mua thêm áo sơ mi của cửa hàng mặc combo cho chất nha [SEP] kiểu dáng form thiết kế mẫu",1
"mua xong phải về bóp lại , không đúng kiểu dáng , mua dùm bạn mình chả thèm mặc luôn",giao_hang,ship giao hàng vận chuyển giao lâu,"mua xong phải về bóp lại , không đúng kiểu dáng , mua dùm bạn mình chả thèm mặc luôn [SEP] ship giao hàng vận chuyển giao lâu",0
mặc đẹp vừa nhưng giặt 2 lần chỉ bục toè loe . chán,gia_ca,giá giá tiền mắc rẻ,mặc đẹp vừa nhưng giặt 2 lần chỉ bục toè loe . chán [SEP] giá giá tiền mắc rẻ,0
cái này khâu bằng tay à : đùa tôi đấy à,gia_cong,đường may gia công chỉ may,cái này khâu bằng tay à : đùa tôi đấy à [SEP] đường may gia công chỉ may,1
"hàng đóng gói rất đẹp quả nhiên người bán đã gửi gắm rất nhiều tâm tư và tình cảm trong lúc gói hàng. hộp không có dấu hiệu bị móp, chứng tỏ bộ phận vận chuyển đã nâng như nâng trứng, hứng như hứng hoa. xin nghiêng mình cảm ơn vì tất cả.",mau_sac,màu sắc màu màu sắc đẹp xấu đậm nhạt phai màu khác màu,"hàng đóng gói rất đẹp quả nhiên người bán đã gửi gắm rất nhiều tâm tư và tình cảm trong lúc gói hàng. hộp không có dấu hiệu bị móp, chứng tỏ bộ phận vận chuyển đã nâng như nâng trứng, hứng như hứng hoa. xin nghiêng mình cảm ơn vì tất cả. [SEP] màu sắc màu màu sắc đẹp xấu đậm nhạt phai màu khác màu",0
"giao hàng nhanhh, đóng gói rất cẩn thận luôn, nhất là sơ mi có nhiều kẹp giữ áo. còn chất lượng thì rất là ưng luôn.",uy_tin_cua_hang,uy tín shop cửa hàng đáng tin,"giao hàng nhanhh, đóng gói rất cẩn thận luôn, nhất là sơ mi có nhiều kẹp giữ áo. còn chất lượng thì rất là ưng luôn. [SEP] uy tín shop cửa hàng đáng tin",0
"màu ghi là màu xanh xám nhìn cũ và không giống màu cửa hàng đăng, chất liệu vải phù hợp với giá",gia_ca,giá giá tiền mắc rẻ,"màu ghi là màu xanh xám nhìn cũ và không giống màu cửa hàng đăng, chất liệu vải phù hợp với giá [SEP] giá giá tiền mắc rẻ",1
chất liệu quần ổn nma khi mình nhận hàng có một vết cắt như ảnh,chat_lieu,vải chất liệu vải thun cotton jean kaki,chất liệu quần ổn nma khi mình nhận hàng có một vết cắt như ảnh [SEP] vải chất liệu vải thun cotton jean kaki,1
cửa hàng bị câm.liên hệ không ai phản hồi làm ăn như ccc,kich_co,kích cỡ size rộng chật ôm bó form rộng form nhỏ vừa người quần rộng quần chật áo rộng áo chật,cửa hàng bị câm.liên hệ không ai phản hồi làm ăn như ccc [SEP] kích cỡ size rộng chật ôm bó form rộng form nhỏ vừa người quần rộng quần chật áo rộng áo chật,0
"mình cao m72 nặng từ 55 60kg mà mua 29 cứ như mua 92,ống quần rất rộng và sâu…..ko bao giờ mua lại lần2",kich_co,kích cỡ size rộng chật ôm bó form rộng form nhỏ vừa người quần rộng quần chật áo rộng áo chật,"mình cao m72 nặng từ 55 60kg mà mua 29 cứ như mua 92,ống quần rất rộng và sâu…..ko bao giờ mua lại lần2 [SEP] kích cỡ size rộng chật ôm bó form rộng form nhỏ vừa người quần rộng quần chật áo rộng áo chật",1
"đây là lần thứ 2 mua lại sản phẩm này chỉ là khác màu thôi nhưng mà đợt này thì quần có điểm trừ lớn nhất là còn nhiều chỉ thừa. nhìn chung quần đẹp đúng màu, giao hàng nhanh, kiểu dáng đẹp",chat_luong,chất lượng tốt xấu thất vọng hài lòng,"đây là lần thứ 2 mua lại sản phẩm này chỉ là khác màu thôi nhưng mà đợt này thì quần có điểm trừ lớn nhất là còn nhiều chỉ thừa. nhìn chung quần đẹp đúng màu, giao hàng nhanh, kiểu dáng đẹp [SEP] chất lượng tốt xấu thất vọng hài lòng",1
"chất liệu ổn, vải cũng không đẹp lắm, đường may còn nhiều chỉ thừa",doi_tra,đổi trả hoàn tiền bảo hành,"chất liệu ổn, vải cũng không đẹp lắm, đường may còn nhiều chỉ thừa [SEP] đổi trả hoàn tiền bảo hành",0
"không biết lần thứ bao nhiêu mua hàng của cửa hàng rồi vì hàng lần nào cũng chất lượng.quần mặc mát ống rộng suông đẹp,xăng tuya chắc chắn.mình cao 1m72 61kg mặc kích cỡ l vừa đẹp.giá thành rẻ hơn thị trường rất nhiều.recommend mua thêm áo sơ mi của cửa hàng mặc combo cho chất nha",kich_co,kích cỡ size rộng chật ôm bó form rộng form nhỏ vừa người quần rộng quần chật áo rộng áo chật,"không biết lần thứ bao nhiêu mua hàng của cửa hàng rồi vì hàng lần nào cũng chất lượng.quần mặc mát ống rộng suông đẹp,xăng tuya chắc chắn.mình cao 1m72 61kg mặc kích cỡ l vừa đẹp.giá thành rẻ hơn thị trường rất nhiều.recommend mua thêm áo sơ mi của cửa hàng mặc combo cho chất nha [SEP] kích cỡ size rộng chật ôm bó form rộng form nhỏ vừa người quần rộng quần chật áo rộng áo chật",1
giao hàng sai. đặt 2 quần lưng keo mà gửi 1 lưng keo 1 lưng thung,giao_hang,ship giao hàng vận chuyển giao lâu,giao hàng sai. đặt 2 quần lưng keo mà gửi 1 lưng keo 1 lưng thung [SEP] ship giao hàng vận chuyển giao lâu,1
quần sử dụng tốt vải thoáng mát có đều may chỉ chưa được chắc chắn sử dụng khoảng 1 tuần đã bị rách tí,chat_lieu,vải chất liệu vải thun cotton jean kaki,quần sử dụng tốt vải thoáng mát có đều may chỉ chưa được chắc chắn sử dụng khoảng 1 tuần đã bị rách tí [SEP] vải chất liệu vải thun cotton jean kaki,1
"mình đánh giá để mọi người biết để mua và suy nghĩ nha quần kích cỡ không được chuẩn cho lắm , cùng 1 kích cỡ mà màu ghi nhỏ hơn và ngắn hơn quần mày đen, khóa của quần rất dổm, nhìn là biết loại khóa rẻ tiền chắc tầm 1k, còn ống quần thì khống đúng với bảng kích cỡ cửa hàng đăng, ống quần kích cỡ 29 chỉ có 15.5cm nhé mọi người. quần không dài cho lắm khá là ngắn, chất vải khá ổn áp",kieu_dang,kiểu dáng form thiết kế mẫu,"mình đánh giá để mọi người biết để mua và suy nghĩ nha quần kích cỡ không được chuẩn cho lắm , cùng 1 kích cỡ mà màu ghi nhỏ hơn và ngắn hơn quần mày đen, khóa của quần rất dổm, nhìn là biết loại khóa rẻ tiền chắc tầm 1k, còn ống quần thì khống đúng với bảng kích cỡ cửa hàng đăng, ống quần kích cỡ 29 chỉ có 15.5cm nhé mọi người. quần không dài cho lắm khá là ngắn, chất vải khá ổn áp [SEP] kiểu dáng form thiết kế mẫu",0
mua 3 cái 3 cái khác nhau hết,uy_tin_cua_hang,uy tín shop cửa hàng đáng tin,mua 3 cái 3 cái khác nhau hết [SEP] uy tín shop cửa hàng đáng tin,1
nhận hàng vừa mới giặt xong đã bị bung chỉ hết 1 đoạn đùi,giao_hang,ship giao hàng vận chuyển giao lâu,nhận hàng vừa mới giặt xong đã bị bung chỉ hết 1 đoạn đùi [SEP] ship giao hàng vận chuyển giao lâu,0
"giao hàng nhanh,chất liệu vải mềm không đứng from,kiểu như thun với rất nhung á,from xấu nói chung giá này thì cũng không tới nỗi bức xúc nhưng chắc tướng ai đẹp lắm mua về đi sửa lại mặc chắc đẹp",mau_sac,màu sắc màu màu sắc đẹp xấu đậm nhạt phai màu khác màu,"giao hàng nhanh,chất liệu vải mềm không đứng from,kiểu như thun với rất nhung á,from xấu nói chung giá này thì cũng không tới nỗi bức xúc nhưng chắc tướng ai đẹp lắm mua về đi sửa lại mặc chắc đẹp [SEP] màu sắc màu màu sắc đẹp xấu đậm nhạt phai màu khác màu",0
ở trên live đã hỏi cao m76 nặng 75kh eo 87 tư vấn kích cỡ 33 bảo là yên tâm chắc chắn vừa giờ nhận được hàng mặc thử thì rất chật cố cắt cái cút nới ra hết cỡ vẫn chật chán cửa hàng tư vấn chán vkl giờ mặc không vừa bỏ thôi chứ làm gì được,cham_soc_khach_hang,tư vấn chăm sóc khách hàng rep tin nhắn phản hồi hỗ trợ trả lời chậm thái độ nhân viên,ở trên live đã hỏi cao m76 nặng 75kh eo 87 tư vấn kích cỡ 33 bảo là yên tâm chắc chắn vừa giờ nhận được hàng mặc thử thì rất chật cố cắt cái cút nới ra hết cỡ vẫn chật chán cửa hàng tư vấn chán vkl giờ mặc không vừa bỏ thôi chứ làm gì được [SEP] tư vấn chăm sóc khách hàng rep tin nhắn phản hồi hỗ trợ trả lời chậm thái độ nhân viên,1
