sentence,aspect,description,input_text,label
"mua quần ống rộng, cũng.mong ước các kiểu lúc hàng về thất vọng tràn bờ đê, quần như cái quần tây bth ống quần còn ôm.chân nửa thấy đánh giá ổn nên mua mà giờ vậy cũng kb nói sao, nch vải thì tốt tạm đánh giá 4 sao cho việc vải ổn",chat_lieu,vải chất liệu vải thun cotton jean kaki,"mua quần ống rộng, cũng.mong ước các kiểu lúc hàng về thất vọng tràn bờ đê, quần như cái quần tây bth ống quần còn ôm.chân nửa thấy đánh giá ổn nên mua mà giờ vậy cũng kb nói sao, nch vải thì tốt tạm đánh giá 4 sao cho việc vải ổn [SEP] vải chất liệu vải thun cotton jean kaki",1
"đây là chiếc quần tôi thấy hài lòng nhất kể từ khi mua hàng online, vừa rẻ , vừa co giãn, giá cả phải chăng, mấy lần trước mua cái quần hơn 7 chục ngàn về vứt đi không mặc được đúng là tiền nào của nấy, không nên mua những đồ rất rẻ tiền trên mạng . tặng cửa hàng này 5 sao, tôi sẽ giới thiệu thêm cho bạn bè mì",mau_sac,màu sắc màu màu sắc đẹp xấu đậm nhạt phai màu khác màu,"đây là chiếc quần tôi thấy hài lòng nhất kể từ khi mua hàng online, vừa rẻ , vừa co giãn, giá cả phải chăng, mấy lần trước mua cái quần hơn 7 chục ngàn về vứt đi không mặc được đúng là tiền nào của nấy, không nên mua những đồ rất rẻ tiền trên mạng . tặng cửa hàng này 5 sao, tôi sẽ giới thiệu thêm cho bạn bè mì [SEP] màu sắc màu màu sắc đẹp xấu đậm nhạt phai màu khác màu",0
"quần siu đẹp đường may đẹp không có chỉ thừa, nhìn như này không nghĩ là giá rẻ vậy luôn, giao hàng cũng khá nhanh và đóng gói cẩn thận",kieu_dang,kiểu dáng form thiết kế mẫu,"quần siu đẹp đường may đẹp không có chỉ thừa, nhìn như này không nghĩ là giá rẻ vậy luôn, giao hàng cũng khá nhanh và đóng gói cẩn thận [SEP] kiểu dáng form thiết kế mẫu",0
đặt màu đen xog mở ra so với quần âu ở nhà lại đen không ra đen xanh navy không ra xanh navy chả hiểu làm ăn kiểu gì nữa,gia_cong,đường may gia công chỉ may,đặt màu đen xog mở ra so với quần âu ở nhà lại đen không ra đen xanh navy không ra xanh navy chả hiểu làm ăn kiểu gì nữa [SEP] đường may gia công chỉ may,0
"mặc được chục lần thì ống quần sờm đầy vải ra. chất liệu vải kém, đường may không vấn đề gì.",kieu_dang,kiểu dáng form thiết kế mẫu,"mặc được chục lần thì ống quần sờm đầy vải ra. chất liệu vải kém, đường may không vấn đề gì. [SEP] kiểu dáng form thiết kế mẫu",0
cửa hàng giao sản phẩm lỗi bị rách chỉ thừa tùm lum đổi trả mất mấy hôm còn vải quần dùng thời gian thì bị cứng không còn suông mềm nữa phần túi khi giặt rất dễ bị tưa chỉ với bung cúc quần nhé,do_ben,độ bền bền rách bung hỏng,cửa hàng giao sản phẩm lỗi bị rách chỉ thừa tùm lum đổi trả mất mấy hôm còn vải quần dùng thời gian thì bị cứng không còn suông mềm nữa phần túi khi giặt rất dễ bị tưa chỉ với bung cúc quần nhé [SEP] độ bền bền rách bung hỏng,1
"giá rẻ, kiểu dáng đẹp không bó cũng không baggy mà suông theo chân nhưng dễ nhăn và chất lượng hoàn thiện rất xấu chỉ thừa nhiều vô kể ngồi cắt mãi ms hết",do_ben,độ bền bền rách bung hỏng,"giá rẻ, kiểu dáng đẹp không bó cũng không baggy mà suông theo chân nhưng dễ nhăn và chất lượng hoàn thiện rất xấu chỉ thừa nhiều vô kể ngồi cắt mãi ms hết [SEP] độ bền bền rách bung hỏng",0
"mik m65 55ki mặc quần này rộng 10 phân, bạn nào định mua thì nên giảm 1 kích cỡ eo nhỏ giảm 2 kích cỡ giá rẻ không đòi hỏi nhiều nhưng mà đáy quần dằn ngược là không thể hiểu, dẫn đến so le, mặc bị cộm đáy.",kieu_dang,kiểu dáng form thiết kế mẫu,"mik m65 55ki mặc quần này rộng 10 phân, bạn nào định mua thì nên giảm 1 kích cỡ eo nhỏ giảm 2 kích cỡ giá rẻ không đòi hỏi nhiều nhưng mà đáy quần dằn ngược là không thể hiểu, dẫn đến so le, mặc bị cộm đáy. [SEP] kiểu dáng form thiết kế mẫu",0
không hài lòng về sản phẩm nhiều chỉ thừa và bị hỏng phần con đỉa quần,mau_sac,màu sắc màu màu sắc đẹp xấu đậm nhạt phai màu khác màu,không hài lòng về sản phẩm nhiều chỉ thừa và bị hỏng phần con đỉa quần [SEP] màu sắc màu màu sắc đẹp xấu đậm nhạt phai màu khác màu,0
"chất liệu tốt như những gì đã miêu tả, không hề có 1 sợi chỉ dư nào, sẽ tiếp tục ủng hộ cửa hàng trong thời gian tới.",gia_ca,giá giá tiền mắc rẻ,"chất liệu tốt như những gì đã miêu tả, không hề có 1 sợi chỉ dư nào, sẽ tiếp tục ủng hộ cửa hàng trong thời gian tới. [SEP] giá giá tiền mắc rẻ",0
rất thích cái cách cửa hàng tư vấn kích cỡ,cham_soc_khach_hang,tư vấn chăm sóc khách hàng rep tin nhắn phản hồi hỗ trợ trả lời chậm thái độ nhân viên,rất thích cái cách cửa hàng tư vấn kích cỡ [SEP] tư vấn chăm sóc khách hàng rep tin nhắn phản hồi hỗ trợ trả lời chậm thái độ nhân viên,1
nhắn tim dặn cửa hàng che tên với giá tiền mà cửa hàng không che,chat_luong,chất lượng tốt xấu thất vọng hài lòng,nhắn tim dặn cửa hàng che tên với giá tiền mà cửa hàng không che [SEP] chất lượng tốt xấu thất vọng hài lòng,0
"quần hơi mỏng vải đẹp còn chỉ thừa rất rộng so với kích cỡ , nên đặt nhỏ lại 2 kích cỡ so với bảng kích cỡ nhé rộng eo bị dài đành đưa người khác mang",kich_co,kích cỡ size rộng chật ôm bó form rộng form nhỏ vừa người quần rộng quần chật áo rộng áo chật,"quần hơi mỏng vải đẹp còn chỉ thừa rất rộng so với kích cỡ , nên đặt nhỏ lại 2 kích cỡ so với bảng kích cỡ nhé rộng eo bị dài đành đưa người khác mang [SEP] kích cỡ size rộng chật ôm bó form rộng form nhỏ vừa người quần rộng quần chật áo rộng áo chật",1
"giao hàng rất lâu. đặt hàng 26 11, 7 ngày sau mới có hàng. mình đặt 34 mà giao 32. nhắn thì cửa hàng hổ trợ đổi hàng miễn phí. ngày 2 12 đợi tới 6 12 5 ngày thì mới giao. nhưng lại đổi 30. cửa hàng lại hứa đổi, xong quên. 7 ngày sau mình nhắc thì cửa hàng mới lên đơn. tới 18 12 luôn mới có. rất buồn.",giao_hang,ship giao hàng vận chuyển giao lâu,"giao hàng rất lâu. đặt hàng 26 11, 7 ngày sau mới có hàng. mình đặt 34 mà giao 32. nhắn thì cửa hàng hổ trợ đổi hàng miễn phí. ngày 2 12 đợi tới 6 12 5 ngày thì mới giao. nhưng lại đổi 30. cửa hàng lại hứa đổi, xong quên. 7 ngày sau mình nhắc thì cửa hàng mới lên đơn. tới 18 12 luôn mới có. rất buồn. [SEP] ship giao hàng vận chuyển giao lâu",1
"tư vấn kích cỡ không vừa , mãi không cho đổi kích cỡ . rất chán",dong_goi,đóng gói bao bì đóng hộp,"tư vấn kích cỡ không vừa , mãi không cho đổi kích cỡ . rất chán [SEP] đóng gói bao bì đóng hộp",0
"không ngờ với mức giá này lại có thể mua được sản phẩm chất lượng ngư thế , chưa bao giờ phải thất vọng về sản phẩm của jbagy , chất lượng tốt , chăm sóc khách hàng chu đáo , rất đáng tiền",mau_sac,màu sắc màu màu sắc đẹp xấu đậm nhạt phai màu khác màu,"không ngờ với mức giá này lại có thể mua được sản phẩm chất lượng ngư thế , chưa bao giờ phải thất vọng về sản phẩm của jbagy , chất lượng tốt , chăm sóc khách hàng chu đáo , rất đáng tiền [SEP] màu sắc màu màu sắc đẹp xấu đậm nhạt phai màu khác màu",0
1 sao 1 sao 1 sao .vải xấu quần may xấu . hỏi cửa hàng để đổi lại không thấy trả lời mọi người đừng mua,mau_sac,màu sắc màu màu sắc đẹp xấu đậm nhạt phai màu khác màu,1 sao 1 sao 1 sao .vải xấu quần may xấu . hỏi cửa hàng để đổi lại không thấy trả lời mọi người đừng mua [SEP] màu sắc màu màu sắc đẹp xấu đậm nhạt phai màu khác màu,0
rất tốt nhưng vì thái độ của người giao hàng nên 2 sao,giao_hang,ship giao hàng vận chuyển giao lâu,rất tốt nhưng vì thái độ của người giao hàng nên 2 sao [SEP] ship giao hàng vận chuyển giao lâu,1
quần kích cỡ to nhất nhưng cảm giác không đúng kích cỡ cho lắm: mình mua cho m8 nhưng nhận quần về chui thử vào thì 1 đứa m55 cũng vừa chiều dài ống. vậy các bạn cao tí nữa mặc là thành quần lửng. áo sơ mi mua cùng chỗ chất khá đẹp tuy nhiên vẫn bị bé nếu so với các kích cỡ tương tự từ các brand khác:,doi_tra,đổi trả hoàn tiền bảo hành,quần kích cỡ to nhất nhưng cảm giác không đúng kích cỡ cho lắm: mình mua cho m8 nhưng nhận quần về chui thử vào thì 1 đứa m55 cũng vừa chiều dài ống. vậy các bạn cao tí nữa mặc là thành quần lửng. áo sơ mi mua cùng chỗ chất khá đẹp tuy nhiên vẫn bị bé nếu so với các kích cỡ tương tự từ các brand khác: [SEP] đổi trả hoàn tiền bảo hành,0
cứ tưởng kích cỡ 33 sẽ dài hơn kích cỡ 32 nhưng không hề nhé nó chỉ rộng lưng với ống quần thôi chứ chiều dài y hệt mắc công đi bóp lại nữa nhma vải ổng kiểu dáng đẹp,kich_co,kích cỡ size rộng chật ôm bó form rộng form nhỏ vừa người quần rộng quần chật áo rộng áo chật,cứ tưởng kích cỡ 33 sẽ dài hơn kích cỡ 32 nhưng không hề nhé nó chỉ rộng lưng với ống quần thôi chứ chiều dài y hệt mắc công đi bóp lại nữa nhma vải ổng kiểu dáng đẹp [SEP] kích cỡ size rộng chật ôm bó form rộng form nhỏ vừa người quần rộng quần chật áo rộng áo chật,1
"chất liệu mỏng nhũn hư fom, túi quần trước chật, túi quần sau không có cúc gài giao hàng chậm",giao_hang,ship giao hàng vận chuyển giao lâu,"chất liệu mỏng nhũn hư fom, túi quần trước chật, túi quần sau không có cúc gài giao hàng chậm [SEP] ship giao hàng vận chuyển giao lâu",1
"giá rẻ, kiểu dáng đẹp không bó cũng không baggy mà suông theo chân nhưng dễ nhăn và chất lượng hoàn thiện rất xấu chỉ thừa nhiều vô kể ngồi cắt mãi ms hết",gia_cong,đường may gia công chỉ may,"giá rẻ, kiểu dáng đẹp không bó cũng không baggy mà suông theo chân nhưng dễ nhăn và chất lượng hoàn thiện rất xấu chỉ thừa nhiều vô kể ngồi cắt mãi ms hết [SEP] đường may gia công chỉ may",1
"giao hàng nhanh, vải đẹp co giãn, màu sắc đẹp đúng với mô tả. đợt trước mua có 140k mà nay đã 169k rồi . 😂 mua tặng bố mặc tết này nên chưa thử",kich_co,kích cỡ size rộng chật ôm bó form rộng form nhỏ vừa người quần rộng quần chật áo rộng áo chật,"giao hàng nhanh, vải đẹp co giãn, màu sắc đẹp đúng với mô tả. đợt trước mua có 140k mà nay đã 169k rồi . 😂 mua tặng bố mặc tết này nên chưa thử [SEP] kích cỡ size rộng chật ôm bó form rộng form nhỏ vừa người quần rộng quần chật áo rộng áo chật",0
quần đẹp kiểu dáng cũng đẹp . có mỗi tội cấn lễ giao rất lâu không có quần đi chơi với crush nên chấm 1 sao,chat_luong,chất lượng tốt xấu thất vọng hài lòng,quần đẹp kiểu dáng cũng đẹp . có mỗi tội cấn lễ giao rất lâu không có quần đi chơi với crush nên chấm 1 sao [SEP] chất lượng tốt xấu thất vọng hài lòng,1
lộn hàng mất thời gian mua hàng 189 giao 159 lộn khôn thế quần thì rộng cố ý giao lộn rõ ràng,doi_tra,đổi trả hoàn tiền bảo hành,lộn hàng mất thời gian mua hàng 189 giao 159 lộn khôn thế quần thì rộng cố ý giao lộn rõ ràng [SEP] đổi trả hoàn tiền bảo hành,0
quần đẹp vải tốt nhiều chỉ thừa túi nhỏ người bán tư vấn không có tâm,dong_goi,đóng gói bao bì đóng hộp,quần đẹp vải tốt nhiều chỉ thừa túi nhỏ người bán tư vấn không có tâm [SEP] đóng gói bao bì đóng hộp,0
"mình xin góp ý tí chất liệu rất tốt, dây kéo khóa quần rất mượt. xứng đáng 10 điểm cho chất lượng. mình mua 2 quần 1 quần ống rộng và 1 quần ống côn đều kích cỡ 34 nhưng 1 cái thì vừa 1 cái thì hơi chật tí. và có dư một ít chỉ như hình",gia_ca,giá giá tiền mắc rẻ,"mình xin góp ý tí chất liệu rất tốt, dây kéo khóa quần rất mượt. xứng đáng 10 điểm cho chất lượng. mình mua 2 quần 1 quần ống rộng và 1 quần ống côn đều kích cỡ 34 nhưng 1 cái thì vừa 1 cái thì hơi chật tí. và có dư một ít chỉ như hình [SEP] giá giá tiền mắc rẻ",0
"sản phẩm giao nhanh, với giá 160k thì sản phẩm này gọi là tạm chấp nhận được chứ mà bán với giá gốc 300 cành thì quần này rất xấu quần chỉ thừa rất nhiều. chất lượng hoàn thiện chưa cao, không ai nói đây là hàng cao cấp cả, chỉ là quần thường thôi, đường may xấu không đều",kich_co,kích cỡ size rộng chật ôm bó form rộng form nhỏ vừa người quần rộng quần chật áo rộng áo chật,"sản phẩm giao nhanh, với giá 160k thì sản phẩm này gọi là tạm chấp nhận được chứ mà bán với giá gốc 300 cành thì quần này rất xấu quần chỉ thừa rất nhiều. chất lượng hoàn thiện chưa cao, không ai nói đây là hàng cao cấp cả, chỉ là quần thường thôi, đường may xấu không đều [SEP] kích cỡ size rộng chật ôm bó form rộng form nhỏ vừa người quần rộng quần chật áo rộng áo chật",0
hàng thực sự rất tốt so với gía tiền. nhưng mà giao hàng n cứ pải gọi lại lâu vcđ,doi_tra,đổi trả hoàn tiền bảo hành,hàng thực sự rất tốt so với gía tiền. nhưng mà giao hàng n cứ pải gọi lại lâu vcđ [SEP] đổi trả hoàn tiền bảo hành,0
"vải mềm có độ giãn, lưng quần khá cứng, mua 2 cái 1m74 61kg cửa hàng tư vấn kích cỡ 30 bị chật mặc không vừa đành đem cho",kich_co,kích cỡ size rộng chật ôm bó form rộng form nhỏ vừa người quần rộng quần chật áo rộng áo chật,"vải mềm có độ giãn, lưng quần khá cứng, mua 2 cái 1m74 61kg cửa hàng tư vấn kích cỡ 30 bị chật mặc không vừa đành đem cho [SEP] kích cỡ size rộng chật ôm bó form rộng form nhỏ vừa người quần rộng quần chật áo rộng áo chật",1
"dáng quần rất đẹp và thoải mái luôn, chất rất mát mẻ và dày dặn, giá cả lại phải chăng, không còn gì để chê nữa 🤗",mau_sac,màu sắc màu màu sắc đẹp xấu đậm nhạt phai màu khác màu,"dáng quần rất đẹp và thoải mái luôn, chất rất mát mẻ và dày dặn, giá cả lại phải chăng, không còn gì để chê nữa 🤗 [SEP] màu sắc màu màu sắc đẹp xấu đậm nhạt phai màu khác màu",0
"èo ôi mua còn hỏi trước có rộng không mà cửa hàng tl không rộng chắc hơn đinh đóng cột không vòng vo thêm từ nào luôn , quần mặc bụng rộng ống dài đi sửa mất nửa cái quần luôn , mặc như bơi trong cái quần , nhưng phải công nhận quần đẹp mỗi tội tư vấn chán , đánh giá trước không qua năm mới , cửa hàng lại đổ tội mất giông",kieu_dang,kiểu dáng form thiết kế mẫu,"èo ôi mua còn hỏi trước có rộng không mà cửa hàng tl không rộng chắc hơn đinh đóng cột không vòng vo thêm từ nào luôn , quần mặc bụng rộng ống dài đi sửa mất nửa cái quần luôn , mặc như bơi trong cái quần , nhưng phải công nhận quần đẹp mỗi tội tư vấn chán , đánh giá trước không qua năm mới , cửa hàng lại đổ tội mất giông [SEP] kiểu dáng form thiết kế mẫu",1
quần mua cho người yêu mang tết . mà quần bị dơ ở ống quần vơi lại quần hôi lắm không phải mùi vải mà mùi á. mình đưa cho người yêu ngửi cũng nói hôi. được cái giao hàng nhanh thôi,kich_co,kích cỡ size rộng chật ôm bó form rộng form nhỏ vừa người quần rộng quần chật áo rộng áo chật,quần mua cho người yêu mang tết . mà quần bị dơ ở ống quần vơi lại quần hôi lắm không phải mùi vải mà mùi á. mình đưa cho người yêu ngửi cũng nói hôi. được cái giao hàng nhanh thôi [SEP] kích cỡ size rộng chật ôm bó form rộng form nhỏ vừa người quần rộng quần chật áo rộng áo chật,0
fom dáng đẹp chất liệu đẹp nhưng cạp quần rất kì rộng,chat_luong,chất lượng tốt xấu thất vọng hài lòng,fom dáng đẹp chất liệu đẹp nhưng cạp quần rất kì rộng [SEP] chất lượng tốt xấu thất vọng hài lòng,0
"sp vải cũng tốt rẻ trong tầm giá, có cái không thích là tl tin nhắn hơi chậm. khi đặt hàng bên cửa hàng tư vấn kích cỡ 31 mình sợ không vừa đặt 32 luôn nhưng về mặc vẫn không vừa, cửa hàng vẫn cho đổi trả nhưng phải chịu giao hàng 2 chìu mặc dù cửa hàng đã tư vấn kích cỡ cho mình",kich_co,kích cỡ size rộng chật ôm bó form rộng form nhỏ vừa người quần rộng quần chật áo rộng áo chật,"sp vải cũng tốt rẻ trong tầm giá, có cái không thích là tl tin nhắn hơi chậm. khi đặt hàng bên cửa hàng tư vấn kích cỡ 31 mình sợ không vừa đặt 32 luôn nhưng về mặc vẫn không vừa, cửa hàng vẫn cho đổi trả nhưng phải chịu giao hàng 2 chìu mặc dù cửa hàng đã tư vấn kích cỡ cho mình [SEP] kích cỡ size rộng chật ôm bó form rộng form nhỏ vừa người quần rộng quần chật áo rộng áo chật",1
cửa hàng nt không thân thiện lắm. hàng không đẹp không ưng ý,chat_luong,chất lượng tốt xấu thất vọng hài lòng,cửa hàng nt không thân thiện lắm. hàng không đẹp không ưng ý [SEP] chất lượng tốt xấu thất vọng hài lòng,1
ủa rồi cái quần gì ngộ vậy cái chỗ cài nút đâu,gia_cong,đường may gia công chỉ may,ủa rồi cái quần gì ngộ vậy cái chỗ cài nút đâu [SEP] đường may gia công chỉ may,1
chất vải ổn .,dong_goi,đóng gói bao bì đóng hộp,chất vải ổn . [SEP] đóng gói bao bì đóng hộp,0
thái độ phục vụ kém . đã inbox riêng cho cửa hàng mà không có phản hồi,cham_soc_khach_hang,tư vấn chăm sóc khách hàng rep tin nhắn phản hồi hỗ trợ trả lời chậm thái độ nhân viên,thái độ phục vụ kém . đã inbox riêng cho cửa hàng mà không có phản hồi [SEP] tư vấn chăm sóc khách hàng rep tin nhắn phản hồi hỗ trợ trả lời chậm thái độ nhân viên,1
"cửa hàng gửi đơn quần thì nhanh, sp đẹp hợp với giá tiền cũng đặt 1 đơn áo của cửa hàng mà hơn chục ngày rồi trên hệ thống vẫn báo lấy hàng không thành công 🤔 đơn quần mình đặt sau đơn áo nhé",doi_tra,đổi trả hoàn tiền bảo hành,"cửa hàng gửi đơn quần thì nhanh, sp đẹp hợp với giá tiền cũng đặt 1 đơn áo của cửa hàng mà hơn chục ngày rồi trên hệ thống vẫn báo lấy hàng không thành công 🤔 đơn quần mình đặt sau đơn áo nhé [SEP] đổi trả hoàn tiền bảo hành",0
vừa nhận được quần chồng mình mặc thử thì rụng phụ tùng. rớt 2 cái nút. rất thích hảng này nhưng hi vọng may và dập nút chắc hơn.,cham_soc_khach_hang,tư vấn chăm sóc khách hàng rep tin nhắn phản hồi hỗ trợ trả lời chậm thái độ nhân viên,vừa nhận được quần chồng mình mặc thử thì rụng phụ tùng. rớt 2 cái nút. rất thích hảng này nhưng hi vọng may và dập nút chắc hơn. [SEP] tư vấn chăm sóc khách hàng rep tin nhắn phản hồi hỗ trợ trả lời chậm thái độ nhân viên,0
hàng giống mô tả giá rẻ nên mua ạ,kich_co,kích cỡ size rộng chật ôm bó form rộng form nhỏ vừa người quần rộng quần chật áo rộng áo chật,hàng giống mô tả giá rẻ nên mua ạ [SEP] kích cỡ size rộng chật ôm bó form rộng form nhỏ vừa người quần rộng quần chật áo rộng áo chật,0
"vừa kiểu dáng nhưng độ hoàn thiện xấu dư vải thừa ở hẳn cái vùng không nên thừa nhất làm mình phải cắt, và sau khi mặc chưa được hai tuần thì tét hẳn một lỗ như trên hình",kieu_dang,kiểu dáng form thiết kế mẫu,"vừa kiểu dáng nhưng độ hoàn thiện xấu dư vải thừa ở hẳn cái vùng không nên thừa nhất làm mình phải cắt, và sau khi mặc chưa được hai tuần thì tét hẳn một lỗ như trên hình [SEP] kiểu dáng form thiết kế mẫu",1
"mới mặc lần đầu gập lên xuống đã đứt chỉ, mua sale giá tính ra 120k 1 quần, chất vải dày dặn màu sắc tươi, có điều đường mai yếu rất nên đánh giá không cao nha",do_ben,độ bền bền rách bung hỏng,"mới mặc lần đầu gập lên xuống đã đứt chỉ, mua sale giá tính ra 120k 1 quần, chất vải dày dặn màu sắc tươi, có điều đường mai yếu rất nên đánh giá không cao nha [SEP] độ bền bền rách bung hỏng",1
túi zip rách te tua,kieu_dang,kiểu dáng form thiết kế mẫu,túi zip rách te tua [SEP] kiểu dáng form thiết kế mẫu,0
m75 60kg mặc kích cỡ 31 sao nó vẫn hơi ngắn ngắn,chat_luong,chất lượng tốt xấu thất vọng hài lòng,m75 60kg mặc kích cỡ 31 sao nó vẫn hơi ngắn ngắn [SEP] chất lượng tốt xấu thất vọng hài lòng,0
"quần áo đẹp y hệt trên hình, chất vải thì dày dặn, cửa hàng có giao hàng hoả tốc tiện dã man, tư vấn nhiệt tình, sẽ mua ủng hộ nhiều hơn rất đáng tiền",cham_soc_khach_hang,tư vấn chăm sóc khách hàng rep tin nhắn phản hồi hỗ trợ trả lời chậm thái độ nhân viên,"quần áo đẹp y hệt trên hình, chất vải thì dày dặn, cửa hàng có giao hàng hoả tốc tiện dã man, tư vấn nhiệt tình, sẽ mua ủng hộ nhiều hơn rất đáng tiền [SEP] tư vấn chăm sóc khách hàng rep tin nhắn phản hồi hỗ trợ trả lời chậm thái độ nhân viên",1
sản phảm còn nhìu chỉ thừa mua lần 1 quần màu đen khá ưng mà lần 2 mua màu xám thấy quần rất mỏng không được như mong đợi,gia_cong,đường may gia công chỉ may,sản phảm còn nhìu chỉ thừa mua lần 1 quần màu đen khá ưng mà lần 2 mua màu xám thấy quần rất mỏng không được như mong đợi [SEP] đường may gia công chỉ may,1
còn chưa cả mặc đã đứt cúc 😢,chat_lieu,vải chất liệu vải thun cotton jean kaki,còn chưa cả mặc đã đứt cúc 😢 [SEP] vải chất liệu vải thun cotton jean kaki,0
